word,meaning,synonyms,antonyms,example_sentences
bureaucracy,"a system of government with many rules","[""administration"", ""red tape"", ""officialdom""]","[""efficiency"", ""simplicity"", ""informality""]","[""The bureaucracy made the process slow.""]"
bureaucratic,"relating to complicated official procedures","[""administrative"", ""governmental"", ""procedural""]","[""informal"", ""simple"", ""efficient""]","[""The bureaucratic process was frustrating.""]"
buttress,"to support or strengthen","[""bolster"", ""reinforce"", ""support""]","[""damage"", ""undermine"", ""weaken""]","[""New evidence will buttress our case.""]"
cacophony,"a harsh mixture of sounds","[""din"", ""discord"", ""noise""]","[""harmony"", ""melody"", ""silence""]","[""The cacophony of car horns filled the street.""]"
cajole,"to persuade by flattery or coaxing","[""coax"", ""persuade"", ""wheedle""]","[""bully"", ""compel"", ""discourage"", ""force""]","[""She tried to cajole him into helping.""]"
calamity,"an event causing great damage","[""catastrophe"", ""disaster"", ""tragedy""]","[""benefit"", ""blessing"", ""fortune""]","[""The flood was a calamity for the village.""]"
calculate,"to work out using maths","[""compute"", ""figure out"", ""determine""]","[""estimate"", ""guess"", ""approximate""]","[""Can you calculate the total cost?""]"
calibre,"the quality or level of ability","[""quality"", ""standard"", ""merit""]","[""mediocrity"", ""inferiority"", ""poorness""]","[""Athletes of this calibre are rare.""]"
callous,"showing cruel disregard for others","[""heartless"", ""insensitive"", ""unfeeling""]","[""caring"", ""compassionate"", ""kind"", ""sympathetic""]","[""His callous remarks hurt her deeply."", ""His callous remarks upset everyone.""]"
calm,"peaceful and quiet without worry","[""peaceful"", ""relaxed"", ""tranquil""]","[""anxious"", ""worried"", ""agitated""]","[""The calm sea was perfect for swimming.""]"
camaraderie,"mutual trust and friendship","[""fellowship"", ""friendship"", ""solidarity""]","[""antagonism"", ""enmity"", ""hostility""]","[""There was great camaraderie among the team.""]"
campaign,"an organised effort to achieve a goal","[""drive"", ""movement"", ""effort""]","[""inaction"", ""passivity"", ""surrender""]","[""The campaign to save the park was successful.""]"
candid,"truthful and straightforward","[""frank"", ""honest"", ""open""]","[""dishonest"", ""evasive"", ""secretive""]","[""I appreciate your candid feedback."", ""I appreciate your candid opinion.""]"
candour,"the quality of being open and honest","[""frankness"", ""honesty"", ""openness""]","[""deception"", ""dishonesty"", ""evasiveness"", ""insincerity""]","[""I appreciate your candour on this matter.""]"
capable,"having the ability to do something","[""able"", ""skilled"", ""competent""]","[""incapable"", ""unable"", ""incompetent""]","[""She is capable of solving difficult problems.""]"
capacity,"the maximum amount that can be contained","[""ability"", ""capability"", ""volume""]","[""inability"", ""incapacity"", ""limitation""]","[""The stadium has a capacity of 50000."", ""The stadium has a capacity of 80000.""]"
capitulate,"to cease resistance and surrender","[""submit"", ""surrender"", ""yield""]","[""fight"", ""persevere"", ""resist""]","[""The army was forced to capitulate after the siege."", ""The army was forced to capitulate."", ""The rebels were forced to capitulate.""]"
capricious,"given to sudden changes of mood","[""changeable"", ""fickle"", ""unpredictable""]","[""constant"", ""predictable"", ""steady""]","[""Her capricious behaviour confused everyone."", ""The capricious weather made planning difficult.""]"
captivate,"to attract and hold attention","[""fascinate"", ""charm"", ""enchant""]","[""bore"", ""repel"", ""disgust""]","[""The story will captivate young readers.""]"
capture,"to catch and keep someone or something","[""catch"", ""seize"", ""trap""]","[""release"", ""free"", ""liberate""]","[""The photographer hoped to capture a picture of the fox.""]"
careless,"not paying attention; making mistakes","[""reckless"", ""thoughtless"", ""sloppy""]","[""careful"", ""cautious"", ""attentive""]","[""Careless mistakes cost him the game.""]"
castigate,"to reprimand someone severely","[""chastise"", ""criticise"", ""rebuke""]","[""approve"", ""commend"", ""praise""]","[""The report castigated the company's practices.""]"
catalyst,"something that causes change","[""spark"", ""stimulus"", ""trigger""]","[""deterrent"", ""inhibitor"", ""obstacle""]","[""The event was a catalyst for reform."", ""The speech was a catalyst for change.""]"
catastrophe,"a sudden disaster causing great damage","[""disaster"", ""calamity"", ""tragedy""]","[""blessing"", ""fortune"", ""success""]","[""The earthquake was a terrible catastrophe.""]"
categorical,"absolute and without exception","[""absolute"", ""definite"", ""unconditional""]","[""conditional"", ""qualified"", ""uncertain""]","[""She gave a categorical denial.""]"
caustic,"sarcastic in a bitter way","[""biting"", ""scathing"", ""cutting""]","[""kind"", ""gentle"", ""mild""]","[""Her caustic wit intimidated others.""]"
caution,"being careful to avoid danger","[""care"", ""warning"", ""alertness""]","[""recklessness"", ""carelessness"", ""haste""]","[""Cross the road with caution.""]"
cautious,"being careful to avoid danger or mistakes","[""careful"", ""wary"", ""alert""]","[""careless"", ""reckless"", ""hasty""]","[""Be cautious when crossing the busy road.""]"
cautiously,"doing something carefully to avoid danger","[""carefully"", ""warily"", ""prudently""]","[""carelessly"", ""recklessly"", ""hastily""]","[""She cautiously crossed the icy path.""]"
cease,"to come to an end or stop","[""end"", ""halt"", ""stop""]","[""begin"", ""continue"", ""start""]","[""Hostilities will cease at midnight."", ""The rain will cease by afternoon.""]"
cede,"to give up power or territory","[""relinquish"", ""surrender"", ""yield""]","[""hold"", ""keep"", ""retain""]","[""They were forced to cede control of the region.""]"
celebrate,"to do something special for a happy event","[""rejoice"", ""party"", ""honour""]","[""mourn"", ""ignore"", ""forget""]","[""We will celebrate my birthday with a cake.""]"
censorious,"severely critical of others","[""critical"", ""fault-finding"", ""disapproving""]","[""tolerant"", ""accepting"", ""approving""]","[""The censorious review damaged the film's success.""]"
censure,"to express strong disapproval","[""criticise"", ""condemn"", ""reprimand""]","[""praise"", ""approve"", ""commend""]","[""The committee voted to censure the member.""]"
census,"an official count of people in a country","[""count"", ""survey"", ""poll""]","[""guess"", ""estimate"", ""approximation""]","[""The census happens every ten years.""]"
central,"in the middle or most important","[""middle"", ""main"", ""key""]","[""outer"", ""peripheral"", ""minor""]","[""The central character in the story is a wizard.""]"
cerebral,"relating to the intellect rather than emotions","[""analytical"", ""intellectual"", ""rational""]","[""emotional"", ""instinctive"", ""physical""]","[""It was a cerebral rather than emotional response.""]"
certain,"sure about something without doubt","[""sure"", ""definite"", ""positive""]","[""uncertain"", ""unsure"", ""doubtful""]","[""I am certain that I locked the door.""]"
chagrin,"distress caused by humiliation or failure","[""dismay"", ""embarrassment"", ""mortification""]","[""delight"", ""pleasure"", ""satisfaction""]","[""Much to her chagrin she failed the test."", ""Much to his chagrin he lost the match.""]"
challenge,"something difficult that tests your abilities","[""test"", ""difficulty"", ""task""]","[""ease"", ""simplicity"", ""help""]","[""The puzzle was a real challenge.""]"
chaos,"complete disorder and confusion","[""disorder"", ""confusion"", ""mayhem""]","[""order"", ""peace"", ""harmony""]","[""The classroom was in chaos when the teacher left.""]"
characteristic,"a typical feature or quality","[""feature"", ""trait"", ""quality""]","[""abnormality"", ""exception"", ""irregularity""]","[""Honesty is a characteristic I admire.""]"
charlatan,"a person falsely claiming expertise","[""fake"", ""fraud"", ""impostor""]","[""authentic"", ""authority"", ""expert"", ""genuine"", ""professional""]","[""The charlatan was exposed as a fraud.""]"
charming,"very pleasant and likeable","[""delightful"", ""lovely"", ""enchanting""]","[""unpleasant"", ""rude"", ""repulsive""]","[""The charming village had pretty cottages.""]"
chase,"to run after someone or something","[""pursue"", ""follow"", ""hunt""]","[""flee"", ""escape"", ""retreat""]","[""The dog loves to chase squirrels.""]"
chastise,"to criticise or punish severely","[""rebuke"", ""reprimand"", ""scold""]","[""commend"", ""praise"", ""reward""]","[""The teacher had to chastise the disruptive student.""]"
cherish,"to love and care for something dearly","[""treasure"", ""value"", ""adore""]","[""neglect"", ""ignore"", ""discard""]","[""I cherish the memories of our holiday.""]"
chronic,"persisting for a long time","[""constant"", ""long-lasting"", ""ongoing"", ""persistent""]","[""acute"", ""brief"", ""temporary""]","[""She suffers from chronic back pain."", ""She suffers from chronic fatigue.""]"
chronicle,"a factual account of events in order","[""record"", ""account"", ""history""]","[""fiction"", ""fabrication"", ""myth""]","[""The book chronicles the history of Rome.""]"
circulate,"to move around or spread","[""spread"", ""distribute"", ""flow""]","[""collect"", ""gather"", ""block""]","[""Blood circulates through the body.""]"
circumspect,"careful to consider all circumstances","[""cautious"", ""careful"", ""prudent""]","[""reckless"", ""careless"", ""imprudent""]","[""Be circumspect when making decisions.""]"
circumstance,"a condition or fact affecting a situation","[""situation"", ""condition"", ""factor""]","[""certainty"", ""control"", ""plan""]","[""Under the circumstance we had no choice.""]"
circumvent,"to find a way around an obstacle","[""bypass"", ""avoid"", ""evade""]","[""confront"", ""face"", ""address""]","[""They tried to circumvent the regulations.""]"
cite,"to mention as an example or proof","[""quote"", ""mention"", ""refer to""]","[""ignore"", ""omit"", ""overlook""]","[""The lawyer will cite several cases.""]"
clandestine,"kept secret or done secretly","[""covert"", ""secret"", ""undercover""]","[""open"", ""overt"", ""public""]","[""The clandestine meeting was held at night."", ""They held clandestine meetings at night.""]"
clarify,"to make something clearer or easier to understand","[""explain"", ""clear up"", ""simplify""]","[""confuse"", ""obscure"", ""complicate""]","[""Please clarify what you mean.""]"
classify,"to arrange things into groups or categories","[""categorise"", ""sort"", ""organise""]","[""mix"", ""combine"", ""jumble""]","[""Scientists classify animals into groups.""]"
clemency,"mercy or leniency towards an offender","[""compassion"", ""forgiveness"", ""leniency"", ""mercy""]","[""harshness"", ""punishment"", ""severity"", ""strictness""]","[""The judge showed clemency in sentencing."", ""The judge showed clemency to the offender.""]"
clever,"quick to learn and understand things","[""smart"", ""intelligent"", ""bright""]","[""foolish"", ""silly"", ""slow""]","[""The clever fox found a way to escape.""]"
climate,"the usual weather conditions in an area","[""weather"", ""atmosphere"", ""conditions""]","[""short-term weather"", ""daily weather"", ""brief weather""]","[""The tropical climate is hot and humid.""]"
clumsy,"moving awkwardly and knocking things over","[""awkward"", ""uncoordinated"", ""ungainly""]","[""graceful"", ""nimble"", ""agile""]","[""The clumsy elephant knocked over the chairs.""]"
coalesce,"to come together to form one whole","[""combine"", ""merge"", ""unite""]","[""disperse"", ""divide"", ""separate"", ""split""]","[""The groups began to coalesce into one."", ""The groups began to coalesce.""]"
coarse,"rough in texture; or rude in manner","[""rough"", ""crude"", ""harsh""]","[""smooth"", ""fine"", ""refined""]","[""The coarse sand scratched my feet.""]"
coax,"to persuade gently","[""cajole"", ""persuade"", ""wheedle""]","[""bully"", ""compel"", ""force""]","[""She tried to coax the cat out from under the bed.""]"
coerce,"to persuade using force or threats","[""compel"", ""force"", ""pressure""]","[""allow"", ""convince"", ""encourage"", ""persuade""]","[""No one should coerce you into agreeing.""]"
cogent,"clear and logical; convincing","[""convincing"", ""compelling"", ""persuasive""]","[""weak"", ""unconvincing"", ""illogical""]","[""She presented a cogent argument.""]"
cognisant,"having knowledge or awareness","[""aware"", ""conscious"", ""mindful""]","[""unaware"", ""ignorant"", ""oblivious""]","[""I am cognisant of the risks involved.""]"
coherent,"logical and consistent","[""clear"", ""consistent"", ""logical"", ""reasoned""]","[""confused"", ""confusing"", ""illogical"", ""incoherent""]","[""Write a coherent argument in your essay."", ""Write a coherent essay with clear arguments."", ""Write a coherent paragraph with clear ideas.""]"
coincide,"to happen at the same time","[""occur together"", ""match"", ""correspond""]","[""differ"", ""clash"", ""diverge""]","[""Our holidays coincide this year.""]"
collaborate,"to work jointly with others","[""cooperate"", ""partner"", ""team up"", ""work together""]","[""compete"", ""hinder"", ""oppose"", ""work alone""]","[""The artists will collaborate on the project."", ""The scientists will collaborate on research.""]"
collapse,"to fall down suddenly","[""cave in"", ""crumble"", ""fail"", ""fall""]","[""build"", ""rise"", ""stand"", ""succeed""]","[""The old bridge might collapse soon."", ""The old building might collapse soon.""]"
collect,"to gather things together","[""gather"", ""assemble"", ""accumulate""]","[""scatter"", ""spread"", ""distribute""]","[""I like to collect stamps from different countries.""]"
colloquial,"used in ordinary conversation","[""casual"", ""conversational"", ""informal""]","[""formal"", ""literary"", ""official""]","[""Avoid colloquial language in formal writing."", ""The book uses colloquial language.""]"
comfortable,"feeling relaxed and at ease","[""cosy"", ""relaxed"", ""pleasant""]","[""uncomfortable"", ""uneasy"", ""awkward""]","[""The soft armchair was very comfortable.""]"
command,"to give an order or instruction","[""order"", ""direct"", ""instruct""]","[""obey"", ""follow"", ""request""]","[""The captain gave a command to the sailors.""]"
commemorate,"to recall and honour a memory","[""honour"", ""celebrate"", ""remember""]","[""forget"", ""ignore"", ""neglect""]","[""A statue will commemorate the hero.""]"
commence,"to begin or start something","[""begin"", ""start"", ""initiate""]","[""end"", ""finish"", ""conclude""]","[""The ceremony will commence at noon.""]"
commend,"to praise formally or officially","[""praise"", ""applaud"", ""compliment""]","[""criticise"", ""condemn"", ""censure""]","[""The teacher commended her excellent work.""]"
commensurate,"corresponding in size or degree","[""proportionate"", ""equivalent"", ""comparable""]","[""disproportionate"", ""unequal"", ""unmatched""]","[""Salary will be commensurate with experience.""]"
commit,"to dedicate yourself to something","[""promise"", ""pledge"", ""devote""]","[""abandon"", ""neglect"", ""quit""]","[""I commit to practising every day.""]"
commitment,"a promise or dedication to something","[""dedication"", ""devotion"", ""pledge""]","[""indifference"", ""apathy"", ""neglect""]","[""She showed great commitment to her studies.""]"
common,"happening often or found in many places","[""usual"", ""frequent"", ""ordinary""]","[""rare"", ""unusual"", ""uncommon""]","[""Robins are a common bird in our garden.""]"
compact,"small and neatly packed together","[""compressed"", ""dense"", ""small"", ""tight""]","[""large"", ""loose"", ""spacious""]","[""The compact car is perfect for city driving."", ""The compact car was easy to park.""]"
companion,"a friend who goes with you","[""friend"", ""partner"", ""mate""]","[""enemy"", ""stranger"", ""foe""]","[""My dog is my faithful companion.""]"
comparable,"similar enough to be compared","[""similar"", ""equivalent"", ""like""]","[""different"", ""incomparable"", ""unlike""]","[""The two books are comparable in quality.""]"
compare,"to look at things to see how they are similar or different","[""contrast"", ""examine"", ""match""]","[""ignore"", ""overlook"", ""separate""]","[""Let us compare the two paintings.""]"
compassion,"sympathy and concern for others' suffering","[""sympathy"", ""kindness"", ""empathy""]","[""cruelty"", ""indifference"", ""heartlessness""]","[""She showed compassion for the homeless man.""]"
compassionate,"showing sympathy and concern","[""caring"", ""kind"", ""sympathetic""]","[""callous"", ""cruel"", ""heartless""]","[""Nurses must be compassionate towards patients.""]"
compatible,"able to exist or work together","[""harmonious"", ""suited"", ""matching""]","[""incompatible"", ""unsuited"", ""clashing""]","[""The software is compatible with all devices.""]"
compel,"to force someone to take action","[""force"", ""make"", ""oblige"", ""require""]","[""allow"", ""free"", ""permit""]","[""Evidence will compel them to act."", ""The evidence will compel him to confess.""]"
compelling,"evoking interest or attention strongly","[""convincing"", ""fascinating"", ""gripping""]","[""boring"", ""unconvincing"", ""weak""]","[""The evidence was compelling.""]"
compensate,"to give payment for loss or injury","[""make amends"", ""reimburse"", ""repay"", ""reward""]","[""deprive"", ""penalise"", ""take"", ""withhold""]","[""The company will compensate customers."", ""The company will compensate for the delay.""]"
compete,"to try to win against others","[""contest"", ""rival"", ""challenge""]","[""cooperate"", ""collaborate"", ""share""]","[""The teams will compete in the final match.""]"
competence,"the ability to do something well","[""ability"", ""capability"", ""skill""]","[""inability"", ""incompetence"", ""ineptitude""]","[""Her competence in maths impressed everyone.""]"
competent,"having necessary ability or skills","[""able"", ""capable"", ""proficient"", ""skilled""]","[""incapable"", ""incompetent"", ""unskilled""]","[""She is a competent swimmer."", ""She is a highly competent surgeon.""]"
compile,"to collect and put together information","[""collect"", ""assemble"", ""gather""]","[""scatter"", ""disperse"", ""separate""]","[""We need to compile a list of names.""]"
complacent,"smug and uncritically satisfied","[""content"", ""self-satisfied"", ""smug""]","[""concerned"", ""dissatisfied"", ""vigilant""]","[""Don't become complacent about safety."", ""Don't become complacent about success.""]"
complain,"to say you are unhappy about something","[""moan"", ""grumble"", ""protest""]","[""praise"", ""compliment"", ""accept""]","[""Please do not complain about the food.""]"
complement,"something that completes or enhances","[""accompaniment"", ""addition"", ""enhancement"", ""supplement""]","[""contrast"", ""detraction"", ""opposition"", ""reduction""]","[""The sauce complements the dish perfectly."", ""The side dish complements the meal perfectly.""]"
complete,"to finish something; having all parts","[""finish"", ""whole"", ""entire""]","[""incomplete"", ""unfinished"", ""partial""]","[""I need to complete my homework tonight.""]"
complex,"made of many parts; difficult to understand","[""complicated"", ""intricate"", ""involved""]","[""simple"", ""easy"", ""straightforward""]","[""The puzzle was very complex.""]"
compliance,"acting in accordance with rules","[""obedience"", ""conformity"", ""adherence""]","[""defiance"", ""disobedience"", ""resistance""]","[""Compliance with regulations is mandatory.""]"
compliant,"willing to conform to rules","[""obedient"", ""cooperative"", ""submissive""]","[""defiant"", ""resistant"", ""rebellious""]","[""The company was fully compliant with regulations.""]"
comply,"to obey rules or requests","[""obey"", ""follow"", ""conform""]","[""disobey"", ""defy"", ""resist""]","[""Everyone must comply with the safety rules.""]"
component,"a part of something larger","[""part"", ""element"", ""piece""]","[""whole"", ""entirety"", ""total""]","[""Each component of the machine is important.""]"
comprehend,"to understand something fully","[""understand"", ""grasp"", ""realise""]","[""misunderstand"", ""confuse"", ""miss""]","[""It took time to comprehend the instructions.""]"
comprehensive,"including all elements; thorough","[""complete"", ""thorough"", ""extensive""]","[""incomplete"", ""partial"", ""limited""]","[""The report provides a comprehensive analysis.""]"
comprise,"to be made up of","[""consist of"", ""contain"", ""include""]","[""exclude"", ""lack"", ""omit""]","[""The committee comprises ten members."", ""The team comprises twelve members.""]"
compromise,"a settlement reached by both sides giving way","[""agreement"", ""concession"", ""deal"", ""settlement""]","[""conflict"", ""disagreement"", ""dispute"", ""intransigence""]","[""They reached a compromise about the schedule."", ""They reached a compromise after negotiation.""]"
compulsion,"an irresistible urge to behave in a way","[""urge"", ""obsession"", ""drive""]","[""choice"", ""freedom"", ""option""]","[""She felt a compulsion to check the door.""]"
compulsory,"required by law or rules","[""mandatory"", ""obligatory"", ""required""]","[""optional"", ""voluntary"", ""elective""]","[""Education is compulsory until age 16.""]"
conceal,"to hide something from view","[""hide"", ""cover"", ""mask""]","[""reveal"", ""show"", ""expose""]","[""He tried to conceal his disappointment.""]"
concede,"to admit something is true after resisting","[""accept"", ""acknowledge"", ""admit""]","[""contest"", ""deny"", ""dispute""]","[""He finally conceded defeat."", ""He had to concede that he was wrong."", ""He had to concede that she was right.""]"
conceited,"excessively proud of oneself","[""vain"", ""arrogant"", ""egotistical""]","[""humble"", ""modest"", ""unassuming""]","[""The conceited actor expected special treatment.""]"
conceive,"to form an idea or become pregnant","[""create"", ""devise"", ""imagine"", ""think of""]","[""abandon"", ""destroy"", ""forget"", ""ignore"", ""overlook""]","[""She conceived a brilliant plan."", ""They conceived an ambitious plan.""]"
concentrate,"to focus your attention on one thing","[""focus"", ""pay attention"", ""think""]","[""daydream"", ""distract"", ""ignore"", ""scatter"", ""wander""]","[""Please concentrate on your work."", ""You need to concentrate during the test.""]"
concept,"an idea or principle","[""idea"", ""notion"", ""principle""]","[""reality"", ""fact"", ""actuality""]","[""The concept of fairness is important.""]"
concern,"a feeling of worry about something","[""worry"", ""care"", ""anxiety""]","[""indifference"", ""unconcern"", ""calm""]","[""There is no concern about the weather tomorrow.""]"
conciliatory,"intended to make peace","[""peacekeeping"", ""placating"", ""mollifying""]","[""confrontational"", ""aggressive"", ""hostile""]","[""Her conciliatory tone eased tensions.""]"
concise,"giving information clearly in few words","[""brief"", ""short"", ""succinct"", ""terse""]","[""lengthy"", ""verbose"", ""wordy""]","[""Keep your answer concise and to the point."", ""Keep your answer concise.""]"
conclude,"to come to an end or reach a decision","[""end"", ""finish"", ""decide""]","[""begin"", ""start"", ""continue""]","[""I conclude that we should go to the park.""]"
conclusive,"putting an end to doubt","[""decisive"", ""definitive"", ""final""]","[""doubtful"", ""inconclusive"", ""uncertain""]","[""The DNA evidence was conclusive."", ""The evidence was conclusive.""]"
concoct,"to make by mixing ingredients or invent a story","[""create"", ""devise"", ""invent""]","[""destroy"", ""disclose"", ""reveal""]","[""The chef will concoct a special dish for you.""]"
concur,"to agree with someone","[""accord"", ""agree"", ""consent""]","[""differ"", ""disagree"", ""oppose""]","[""I concur with your assessment of the situation.""]"
concurrent,"existing or happening at the same time","[""coinciding"", ""parallel"", ""simultaneous""]","[""consecutive"", ""separate"", ""sequential"", ""successive""]","[""The events were concurrent."", ""The two events are concurrent.""]"
condemn,"to express complete disapproval","[""blame"", ""censure"", ""criticise"", ""denounce""]","[""approve"", ""commend"", ""praise""]","[""Leaders condemned the terrorist attack."", ""People condemn cruelty to animals.""]"
condense,"to make something shorter or more compact","[""compress"", ""shorten"", ""reduce""]","[""expand"", ""lengthen"", ""extend""]","[""Please condense your essay to one page.""]"
condescend,"to behave as if superior to others","[""patronise"", ""talk down"", ""look down""]","[""respect"", ""treat as equal""]","[""Don't condescend to your younger siblings.""]"
condescending,"showing a superior attitude","[""patronising"", ""disdainful"", ""supercilious""]","[""respectful"", ""humble"", ""considerate""]","[""His condescending tone was offensive.""]"
condone,"to accept behaviour that is wrong","[""accept"", ""excuse"", ""overlook""]","[""condemn"", ""criticise"", ""forbid""]","[""We cannot condone bullying in any form.""]"
conducive,"making a result likely","[""beneficial"", ""favourable"", ""helpful""]","[""detrimental"", ""harmful"", ""hindering""]","[""A quiet environment is conducive to study."", ""A quiet room is conducive to study.""]"
conduct,"to organise and carry out an activity","[""carry out"", ""perform"", ""lead""]","[""neglect"", ""abandon"", ""ignore""]","[""The scientist will conduct an experiment.""]"
confer,"to grant or have discussions","[""bestow"", ""consult"", ""discuss""]","[""refuse"", ""take"", ""withhold""]","[""The university will confer degrees at graduation.""]"
