word,meaning,synonyms,antonyms,example_sentences
apocryphal,"of doubtful authenticity","[""fabricated"", ""fictitious"", ""spurious""]","[""authentic"", ""genuine"", ""verified""]","[""The story about the ghost is probably apocryphal.""]"
apologise,"to say sorry for something you did","[""say sorry"", ""regret"", ""make amends""]","[""blame"", ""accuse"", ""offend""]","[""I apologise for being late to class.""]"
apotheosis,"the highest point of development","[""climax"", ""peak"", ""pinnacle""]","[""beginning"", ""low point"", ""nadir""]","[""The final match was the apotheosis of his career.""]"
appalling,"causing shock or dismay","[""shocking"", ""dreadful"", ""horrifying""]","[""wonderful"", ""pleasing"", ""delightful""]","[""The conditions in the prison were appalling.""]"
apparatus,"equipment for a particular purpose","[""equipment"", ""device"", ""machinery""]","[""absence"", ""lack"", ""nothing""]","[""The scientific apparatus was expensive.""]"
apparent,"clearly visible or obvious","[""clear"", ""evident"", ""obvious""]","[""concealed"", ""hidden"", ""obscure"", ""unclear""]","[""It was apparent that she was tired.""]"
appear,"to come into sight or become visible","[""show"", ""emerge"", ""arrive""]","[""disappear"", ""vanish"", ""hide""]","[""The sun will appear from behind the clouds.""]"
appease,"to make calm by giving what is demanded","[""pacify"", ""placate"", ""satisfy""]","[""aggravate"", ""anger"", ""provoke""]","[""She gave him sweets to appease his temper."", ""They tried to appease the angry crowd.""]"
appendix,"additional material at the end of a book","[""supplement"", ""addition"", ""attachment""]","[""main text"", ""body"", ""core content""]","[""The appendix contains useful information.""]"
appraisal,"an assessment of value or quality","[""evaluation"", ""assessment"", ""review""]","[""neglect"", ""disregard"", ""ignorance""]","[""The house needs an appraisal before sale.""]"
appreciate,"to be grateful for something","[""value"", ""treasure"", ""be thankful""]","[""ignore"", ""disregard"", ""criticise""]","[""I appreciate your help with my project.""]"
apprehend,"to arrest someone or understand something","[""arrest"", ""capture"", ""grasp""]","[""free"", ""misunderstand"", ""release""]","[""Police managed to apprehend the suspect.""]"
apprehensive,"worried about something that might happen","[""anxious"", ""nervous"", ""worried""]","[""calm"", ""confident"", ""relaxed""]","[""He felt apprehensive about the exam.""]"
approach,"to move closer to something","[""near"", ""advance"", ""come close""]","[""retreat"", ""leave"", ""withdraw""]","[""The cat began to approach the bird slowly.""]"
approbation,"approval or praise","[""approval"", ""endorsement"", ""praise""]","[""condemnation"", ""criticism"", ""disapproval""]","[""The plan received universal approbation.""]"
appropriate,"suitable or proper for a situation","[""suitable"", ""fitting"", ""proper""]","[""inappropriate"", ""unsuitable"", ""wrong""]","[""Wear appropriate clothing for the weather.""]"
approximate,"close to but not exactly","[""rough"", ""estimated"", ""near""]","[""exact"", ""precise"", ""accurate""]","[""The approximate distance is ten miles.""]"
arbitrary,"based on random choice not reason","[""capricious"", ""chance"", ""random"", ""unjustified"", ""unpredictable""]","[""deliberate"", ""justified"", ""logical"", ""planned"", ""reasoned"", ""systematic""]","[""The decision seemed completely arbitrary."", ""The selection seemed arbitrary and unfair."", ""The selection seemed completely arbitrary.""]"
archaic,"very old or old-fashioned","[""ancient"", ""obsolete"", ""outdated""]","[""contemporary"", ""current"", ""modern""]","[""The archaic language was difficult to understand."", ""The law is archaic and needs updating.""]"
ardent,"enthusiastic and passionate","[""enthusiastic"", ""fervent"", ""passionate"", ""zealous""]","[""apathetic"", ""indifferent"", ""lukewarm""]","[""She was an ardent supporter of the cause."", ""She was an ardent supporter of the team.""]"
arduous,"requiring great effort; difficult","[""difficult"", ""strenuous"", ""demanding""]","[""easy"", ""simple"", ""effortless""]","[""The arduous journey took several days.""]"
arrange,"to put things in a particular order","[""organise"", ""order"", ""sort""]","[""scatter"", ""mess up"", ""disorganise""]","[""Please arrange the books on the shelf neatly.""]"
arrive,"to reach a place at the end of a journey","[""reach"", ""come"", ""appear""]","[""leave"", ""depart"", ""go""]","[""We will arrive at the beach by lunchtime.""]"
articulate,"able to express ideas clearly","[""eloquent"", ""expressive"", ""fluent""]","[""inarticulate"", ""mumbling"", ""unclear"", ""vague""]","[""He is very articulate in debates."", ""She gave an articulate presentation."", ""She is very articulate when presenting.""]"
ascend,"to go up or climb","[""climb"", ""rise"", ""mount""]","[""descend"", ""fall"", ""drop""]","[""We watched the balloon ascend into the sky.""]"
ascertain,"to find out for certain","[""discover"", ""determine"", ""establish""]","[""assume"", ""guess"", ""speculate""]","[""We need to ascertain the facts first.""]"
ascetic,"characterised by severe self-discipline","[""austere"", ""self-denying"", ""spartan""]","[""hedonistic"", ""indulgent"", ""luxurious""]","[""The monk lived an ascetic life."", ""The monk lived an ascetic lifestyle.""]"
ashamed,"feeling embarrassed about something you did","[""embarrassed"", ""guilty"", ""sorry""]","[""proud"", ""pleased"", ""confident""]","[""He was ashamed of telling a lie.""]"
aspersion,"an attack on someone's reputation","[""criticism"", ""defamation"", ""slander"", ""slur""]","[""commendation"", ""compliment"", ""praise""]","[""He cast aspersions on her character.""]"
aspiration,"a strong hope or ambition","[""ambition"", ""goal"", ""dream""]","[""apathy"", ""indifference"", ""resignation""]","[""Her aspiration is to become a doctor.""]"
aspire,"to have a strong desire to achieve","[""aim"", ""hope"", ""seek""]","[""abandon"", ""give up"", ""surrender""]","[""She aspires to become a doctor one day."", ""She aspires to become a scientist.""]"
assail,"to attack violently","[""assault"", ""attack"", ""bombard""]","[""defend"", ""protect"", ""shield""]","[""Critics assailed the new policy.""]"
assemble,"to put together or gather","[""gather"", ""collect"", ""construct""]","[""scatter"", ""dismantle"", ""separate""]","[""We need to assemble the furniture.""]"
assent,"agreement or approval","[""agreement"", ""approval"", ""consent""]","[""dissent"", ""disagreement"", ""refusal""]","[""The plan received the committee's assent.""]"
assert,"to state something confidently and forcefully","[""claim"", ""declare"", ""maintain"", ""state""]","[""deny"", ""doubt"", ""question"", ""retract""]","[""He asserted his innocence throughout the trial."", ""She asserted her opinion clearly."", ""She asserted her right to speak at the meeting.""]"
assertion,"a confident statement of fact","[""claim"", ""declaration"", ""statement""]","[""denial"", ""retraction"", ""question""]","[""His assertion was difficult to prove.""]"
assess,"to evaluate or judge something","[""evaluate"", ""judge"", ""appraise""]","[""ignore"", ""overlook"", ""neglect""]","[""The teacher will assess your work fairly.""]"
assessment,"the evaluation of something","[""evaluation"", ""appraisal"", ""analysis""]","[""guess"", ""neglect"", ""ignore""]","[""The assessment showed good progress.""]"
asset,"something useful or valuable","[""advantage"", ""benefit"", ""resource""]","[""liability"", ""drawback"", ""weakness""]","[""Good communication is a valuable asset.""]"
assiduous,"showing great care and perseverance","[""diligent"", ""meticulous"", ""thorough""]","[""careless"", ""lazy"", ""negligent""]","[""She was assiduous in her research."", ""The assiduous student checked every answer twice.""]"
assimilate,"to absorb and understand information","[""absorb"", ""integrate"", ""incorporate""]","[""reject"", ""exclude"", ""separate""]","[""It takes time to assimilate new ideas.""]"
assist,"to help someone with a task","[""help"", ""aid"", ""support""]","[""hinder"", ""obstruct"", ""prevent""]","[""The teacher asked me to assist with the art project.""]"
assuage,"to make an unpleasant feeling less intense","[""ease"", ""relieve"", ""soothe""]","[""aggravate"", ""intensify"", ""worsen""]","[""Nothing could assuage her grief.""]"
assumption,"something accepted as true without proof","[""belief"", ""guess"", ""presumption"", ""supposition""]","[""certainty"", ""fact"", ""proof""]","[""That assumption may be incorrect."", ""That assumption turned out to be wrong.""]"
assure,"to tell someone something with confidence","[""promise"", ""guarantee"", ""convince""]","[""doubt"", ""question"", ""deny""]","[""I assure you the task will be done on time.""]"
astonish,"to surprise someone very much","[""amaze"", ""surprise"", ""shock""]","[""bore"", ""expect"", ""predict""]","[""The magic trick will astonish the audience.""]"
astound,"to shock or amaze greatly","[""amaze"", ""astonish"", ""stun""]","[""bore"", ""underwhelm"", ""expect""]","[""The magic show will astound the audience.""]"
astute,"having sharp judgement","[""shrewd"", ""clever"", ""perceptive""]","[""naive"", ""foolish"", ""gullible""]","[""The astute businessman saw the opportunity.""]"
atrocious,"horrifyingly wicked or of very poor quality","[""appalling"", ""dreadful"", ""terrible""]","[""admirable"", ""excellent"", ""wonderful""]","[""The weather was atrocious during our holiday.""]"
attach,"to join or fasten something to something else","[""connect"", ""fasten"", ""join""]","[""detach"", ""remove"", ""separate""]","[""Please attach the photo to your letter.""]"
attain,"to succeed in achieving something","[""achieve"", ""reach"", ""accomplish""]","[""fail"", ""miss"", ""lose""]","[""She worked hard to attain her dream.""]"
attempt,"to try to do something","[""try"", ""effort"", ""endeavour""]","[""succeed"", ""achieve"", ""give up""]","[""I will attempt to finish my homework before dinner.""]"
attentive,"paying close attention","[""alert"", ""observant"", ""watchful""]","[""inattentive"", ""distracted"", ""careless""]","[""The attentive student never missed a detail.""]"
attract,"to make someone interested or draw closer","[""draw"", ""pull"", ""charm""]","[""repel"", ""push away"", ""discourage""]","[""Bright colours attract butterflies to the garden.""]"
attribute,"a quality or characteristic","[""characteristic"", ""feature"", ""quality""]","[""defect"", ""flaw"", ""weakness""]","[""Kindness is an important attribute."", ""Patience is an important attribute.""]"
attrition,"gradual wearing down of opposition","[""erosion"", ""weakening"", ""depletion""]","[""strengthening"", ""growth"", ""reinforcement""]","[""They won through a war of attrition.""]"
audacious,"showing willingness to take bold risks","[""bold"", ""daring"", ""fearless""]","[""careful"", ""cautious"", ""cowardly"", ""timid""]","[""The audacious escape plan succeeded."", ""The audacious plan surprised everyone.""]"
audacity,"willingness to take bold risks","[""boldness"", ""daring"", ""nerve""]","[""caution"", ""cowardice"", ""timidity""]","[""He had the audacity to question the judge.""]"
augment,"to make something greater by adding to it","[""increase"", ""enhance"", ""supplement""]","[""decrease"", ""reduce"", ""diminish""]","[""She took a job to augment her income.""]"
auspicious,"showing signs of future success","[""favourable"", ""promising"", ""propitious""]","[""unfavourable"", ""inauspicious"", ""ominous""]","[""It was an auspicious start to the project.""]"
austere,"severe in manner or appearance","[""stern"", ""strict"", ""harsh""]","[""lenient"", ""indulgent"", ""luxurious""]","[""The austere headmaster demanded discipline.""]"
authentic,"genuine and not a copy","[""genuine"", ""real"", ""true""]","[""counterfeit"", ""fake"", ""false""]","[""The painting is an authentic masterpiece."", ""The painting was confirmed as authentic.""]"
authorise,"to give official permission for something","[""permit"", ""allow"", ""approve""]","[""forbid"", ""prohibit"", ""ban""]","[""Only the manager can authorise the purchase.""]"
authoritative,"reliable and commanding respect","[""official"", ""credible"", ""expert""]","[""unreliable"", ""dubious"", ""unofficial""]","[""The book is an authoritative guide on birds.""]"
autonomous,"self-governing and independent","[""free"", ""independent"", ""self-governing"", ""self-ruling"", ""sovereign""]","[""controlled"", ""dependent"", ""restricted"", ""subordinate""]","[""The region became an autonomous state."", ""The robot can make autonomous decisions.""]"
available,"ready to be used or accessed","[""accessible"", ""free"", ""obtainable""]","[""busy"", ""occupied"", ""taken"", ""unavailable""]","[""The book is available at the library.""]"
avarice,"extreme greed for wealth or material gain","[""covetousness"", ""cupidity"", ""greed""]","[""altruism"", ""charity"", ""generosity"", ""philanthropy""]","[""His avarice led him to cheat his partners."", ""His avarice led to his downfall.""]"
avaricious,"having extreme greed for wealth","[""greedy"", ""grasping"", ""covetous""]","[""generous"", ""charitable"", ""unselfish""]","[""The avaricious merchant cheated his customers.""]"
aver,"to state or assert something firmly","[""affirm"", ""assert"", ""declare""]","[""contradict"", ""deny"", ""retract""]","[""She averred that she was innocent.""]"
aversion,"a strong dislike or disinclination","[""antipathy"", ""dislike"", ""distaste""]","[""attraction"", ""fondness"", ""liking""]","[""She has an aversion to public speaking."", ""She has an aversion to spiders.""]"
avert,"to prevent something bad from happening","[""prevent"", ""avoid"", ""stop""]","[""cause"", ""allow"", ""enable""]","[""Quick action helped avert a disaster.""]"
avid,"showing keen interest or enthusiasm","[""enthusiastic"", ""keen"", ""eager""]","[""indifferent"", ""apathetic"", ""unenthusiastic""]","[""He is an avid reader of science fiction.""]"
avoid,"to stay away from something","[""dodge"", ""escape"", ""evade""]","[""face"", ""confront"", ""meet""]","[""Try to avoid stepping in puddles.""]"
awkward,"feeling uncomfortable or clumsy","[""clumsy"", ""uncomfortable"", ""uneasy""]","[""graceful"", ""confident"", ""comfortable""]","[""I felt awkward meeting new people.""]"
baffle,"to confuse or perplex someone","[""confuse"", ""puzzle"", ""mystify""]","[""clarify"", ""explain"", ""enlighten""]","[""The riddle continued to baffle everyone.""]"
balance,"to keep steady without falling","[""steady"", ""stabilise"", ""poise""]","[""wobble"", ""fall"", ""topple""]","[""Can you balance on one foot?""]"
baleful,"threatening harm; menacing","[""menacing"", ""sinister"", ""threatening""]","[""benevolent"", ""friendly"", ""kind""]","[""He gave her a baleful glare.""]"
banal,"lacking originality; commonplace","[""ordinary"", ""unoriginal"", ""trite""]","[""original"", ""novel"", ""unique""]","[""The dialogue was banal and predictable.""]"
barbaric,"extremely cruel and savage","[""savage"", ""cruel"", ""brutal""]","[""civilised"", ""humane"", ""kind""]","[""The treatment of prisoners was barbaric.""]"
barrier,"something that blocks the way","[""obstacle"", ""obstruction"", ""blockade""]","[""opening"", ""passage"", ""gateway""]","[""The fence acts as a barrier to keep animals out.""]"
basic,"forming an essential foundation","[""fundamental"", ""essential"", ""simple""]","[""advanced"", ""complex"", ""complicated""]","[""We learned the basic rules of the game.""]"
bastion,"a stronghold of beliefs or ideals","[""citadel"", ""fortress"", ""stronghold""]","[""gap"", ""vulnerability"", ""weakness""]","[""The university is a bastion of free speech.""]"
beam,"to smile very happily","[""grin"", ""smile"", ""radiate""]","[""frown"", ""scowl"", ""glare""]","[""She began to beam with happiness.""]"
beatific,"blissfully happy","[""angelic"", ""blissful"", ""serene""]","[""anguished"", ""miserable"", ""tormented""]","[""A beatific smile spread across her face.""]"
beautiful,"very pleasing to look at or listen to","[""lovely"", ""pretty"", ""gorgeous""]","[""ugly"", ""plain"", ""unattractive""]","[""The sunset was beautiful with pink and orange colours.""]"
beckon,"to signal someone to come closer","[""signal"", ""wave"", ""gesture""]","[""dismiss"", ""repel"", ""ignore""]","[""She beckoned the waiter to come over.""]"
beguile,"to charm or deceive","[""charm"", ""deceive"", ""enchant""]","[""bore"", ""enlighten"", ""repel""]","[""The magician will beguile the audience.""]"
behave,"to act in a particular way","[""act"", ""conduct"", ""perform""]","[""misbehave"", ""disobey"", ""rebel""]","[""Please behave well during the school trip.""]"
believe,"to think something is true","[""trust"", ""accept"", ""have faith""]","[""doubt"", ""disbelieve"", ""question""]","[""I believe you are telling the truth.""]"
belittle,"to make someone seem less important","[""demean"", ""diminish"", ""disparage""]","[""compliment"", ""elevate"", ""praise""]","[""Do not belittle other people's achievements.""]"
belligerent,"hostile and aggressive","[""hostile"", ""aggressive"", ""combative""]","[""peaceful"", ""friendly"", ""cooperative""]","[""The belligerent nations refused to negotiate.""]"
belong,"to be owned by or be a member of","[""own"", ""be part of"", ""fit""]","[""exclude"", ""separate"", ""divide""]","[""This book belongs to the library.""]"
beneath,"in a lower position; under something","[""under"", ""below"", ""underneath""]","[""above"", ""over"", ""on top""]","[""The treasure was buried beneath the old tree.""]"
benefactor,"a person who gives money or help","[""donor"", ""patron"", ""supporter""]","[""detractor"", ""enemy"", ""opponent""]","[""The anonymous benefactor donated millions.""]"
benefit,"something good that helps you","[""advantage"", ""help"", ""gain""]","[""harm"", ""disadvantage"", ""loss""]","[""Exercise has many benefits for your health.""]"
benevolent,"well-meaning and kindly","[""charitable"", ""generous"", ""kind""]","[""cruel"", ""malevolent"", ""unkind""]","[""The benevolent king gave food to the poor."", ""The benevolent leader helped those in need."", ""The benevolent queen helped the poor.""]"
benign,"gentle and kind; not harmful","[""gentle"", ""harmless"", ""kind""]","[""harmful"", ""hostile"", ""malignant""]","[""The doctor confirmed the tumour was benign.""]"
bequeath,"to leave property to someone in a will","[""hand down"", ""leave"", ""pass on""]","[""seize"", ""confiscate"", ""withhold""]","[""She will bequeath her fortune to charity."", ""She will bequeath her paintings to the museum.""]"
berate,"to scold someone angrily","[""criticise"", ""reprimand"", ""rebuke""]","[""praise"", ""commend"", ""compliment""]","[""The coach berated the players for their mistakes.""]"
beseech,"to beg someone earnestly","[""entreat"", ""implore"", ""plead""]","[""command"", ""demand"", ""order""]","[""I beseech you to reconsider your decision.""]"
bewilder,"to confuse someone completely","[""confuse"", ""puzzle"", ""perplex""]","[""clarify"", ""explain"", ""enlighten""]","[""The complex instructions bewildered everyone.""]"
bias,"prejudice in favour or against something","[""prejudice"", ""partiality"", ""favouritism""]","[""fairness"", ""impartiality"", ""neutrality""]","[""The article showed clear political bias.""]"
biased,"unfairly favouring one side","[""prejudiced"", ""partial"", ""unfair""]","[""fair"", ""impartial"", ""neutral""]","[""The referee seemed biased towards the home team.""]"
bilateral,"involving two parties or countries","[""two-sided"", ""mutual"", ""reciprocal""]","[""unilateral"", ""one-sided""]","[""The bilateral agreement benefited both nations.""]"
bitter,"having a sharp unpleasant taste; or resentful","[""sour"", ""harsh"", ""resentful""]","[""sweet"", ""pleasant"", ""kind""]","[""The medicine had a bitter taste.""]"
bizarre,"very strange or unusual","[""strange"", ""weird"", ""peculiar""]","[""normal"", ""ordinary"", ""typical""]","[""The bizarre creature had three eyes.""]"
blame,"to say someone is responsible for something bad","[""accuse"", ""fault"", ""criticise""]","[""praise"", ""forgive"", ""excuse""]","[""Do not blame others for your mistakes.""]"
bland,"lacking strong flavour or character","[""tasteless"", ""dull"", ""uninteresting""]","[""flavourful"", ""interesting"", ""exciting""]","[""The food was rather bland and boring.""]"
blasphemy,"speaking disrespectfully about sacred things","[""irreverence"", ""profanity"", ""sacrilege""]","[""reverence"", ""respect"", ""piety""]","[""His comments were considered blasphemy.""]"
blatant,"done openly without shame","[""brazen"", ""flagrant"", ""obvious"", ""shameless""]","[""subtle"", ""discreet"", ""inconspicuous""]","[""It was a blatant disregard for the rules."", ""It was a blatant lie that fooled nobody.""]"
bleak,"cold and depressing; without hope","[""grim"", ""desolate"", ""dismal""]","[""bright"", ""hopeful"", ""cheerful""]","[""The future looked bleak after the defeat.""]"
blemish,"a small flaw or mark","[""flaw"", ""mark"", ""imperfection""]","[""perfection"", ""flawlessness"", ""purity""]","[""There was a small blemish on the apple.""]"
blend,"to mix things together smoothly","[""mix"", ""combine"", ""merge""]","[""separate"", ""divide"", ""split""]","[""Blend the fruit to make a smoothie.""]"
bliss,"complete happiness","[""joy"", ""happiness"", ""delight""]","[""misery"", ""sadness"", ""despair""]","[""The holiday was pure bliss.""]"
blithe,"showing a casual indifference","[""carefree"", ""casual"", ""unconcerned""]","[""anxious"", ""concerned"", ""worried""]","[""Her blithe disregard for rules was shocking.""]"
blunder,"a stupid or careless mistake","[""mistake"", ""error"", ""slip""]","[""success"", ""achievement"", ""correction""]","[""Making that blunder cost us the game.""]"
boast,"to talk proudly about yourself","[""brag"", ""show off"", ""gloat""]","[""humble"", ""modest"", ""downplay""]","[""It is not nice to boast about winning.""]"
boisterous,"noisy and energetic","[""energetic"", ""lively"", ""rowdy"", ""unruly""]","[""calm"", ""quiet"", ""subdued""]","[""The boisterous children played in the garden."", ""The boisterous crowd cheered loudly.""]"
bold,"brave and not afraid to take risks","[""brave"", ""courageous"", ""daring""]","[""timid"", ""shy"", ""cowardly""]","[""The bold explorer entered the dark cave.""]"
bolster,"to support or strengthen","[""reinforce"", ""strengthen"", ""support""]","[""damage"", ""undermine"", ""weaken""]","[""New evidence will bolster our case.""]"
border,"the edge or boundary of something","[""edge"", ""boundary"", ""limit""]","[""centre"", ""middle"", ""interior""]","[""We crossed the border into Wales.""]"
borrow,"to take something to use and return later","[""take"", ""use"", ""loan""]","[""lend"", ""give"", ""return""]","[""May I borrow your pencil please?""]"
bother,"to annoy or worry someone","[""annoy"", ""disturb"", ""trouble""]","[""help"", ""please"", ""comfort""]","[""Sorry to bother you while you are working.""]"
boundary,"a line that marks the edge of an area","[""border"", ""edge"", ""limit""]","[""centre"", ""interior"", ""middle""]","[""The fence marks the boundary of our garden.""]"
bourgeois,"belonging to the middle class","[""middle-class"", ""conventional"", ""materialistic""]","[""working-class"", ""aristocratic"", ""unconventional""]","[""They criticised bourgeois values.""]"
boycott,"to refuse to buy or use something as a protest","[""ban"", ""avoid"", ""shun""]","[""support"", ""endorse"", ""use""]","[""They decided to boycott the shop.""]"
brandish,"to wave something as a threat","[""display"", ""flourish"", ""wave""]","[""conceal"", ""hide"", ""sheathe""]","[""He brandished the sword at his enemies.""]"
brevity,"concise and exact use of words","[""briefness"", ""conciseness"", ""shortness"", ""terseness""]","[""length"", ""verbosity"", ""wordiness""]","[""I admire the brevity of your speech."", ""The report was praised for its brevity.""]"
brief,"lasting only a short time","[""short"", ""quick"", ""fleeting""]","[""long"", ""lengthy"", ""extended""]","[""The meeting was brief and to the point.""]"
brilliant,"very clever or very bright","[""clever"", ""bright"", ""smart""]","[""dull"", ""dim"", ""stupid""]","[""The brilliant stars lit up the night sky.""]"
brisk,"quick and energetic","[""quick"", ""lively"", ""energetic""]","[""slow"", ""sluggish"", ""lazy""]","[""We went for a brisk walk in the park.""]"
brittle,"hard but easily broken","[""fragile"", ""breakable"", ""crisp""]","[""flexible"", ""strong"", ""tough""]","[""The brittle biscuit crumbled in my hand.""]"
broach,"to raise a subject for discussion","[""introduce"", ""mention"", ""raise""]","[""avoid"", ""ignore"", ""suppress""]","[""I hesitated to broach the subject of money.""]"
broad,"wide from one side to the other","[""wide"", ""extensive"", ""vast""]","[""narrow"", ""thin"", ""limited""]","[""The river was too broad to swim across.""]"
brusque,"abrupt or offhand in manner","[""abrupt"", ""blunt"", ""curt""]","[""courteous"", ""friendly"", ""polite""]","[""His brusque reply offended the customers.""]"
brutal,"extremely harsh or severe","[""savage"", ""cruel"", ""harsh""]","[""gentle"", ""kind"", ""humane""]","[""The brutal heat made the hike difficult.""]"
budget,"a plan for spending money","[""allowance"", ""funds"", ""allocation""]","[""overspending"", ""waste"", ""debt""]","[""We need to stick to our budget.""]"
buoyant,"able to float; cheerful","[""floating"", ""cheerful"", ""optimistic""]","[""sinking"", ""pessimistic"", ""gloomy""]","[""The buoyant ball floated on the water.""]"
burden,"something heavy to carry or a worry","[""load"", ""weight"", ""responsibility""]","[""relief"", ""help"", ""ease""]","[""Carrying all the shopping was a heavy burden.""]"
