level,word,quiz_sentence
2,Abandon,"When the storm intensified and water began flooding the lower decks, the captain reluctantly gave the order to <blank> ship."
2,Abandon,"Sarah felt guilty about her decision to <blank> her piano lessons after five years, but her new job required too much time."
2,Abandon,"The detective found clues suggesting the family had to <blank> their home in a hurry, leaving behind valuable possessions and personal belongings."
2,Abandon,"After three unsuccessful attempts to climb the treacherous north face, the expedition team decided to <blank> their summit attempt."
2,Abandon,The council's plan to <blank> the old railway line sparked protests from local residents who cherished the historic route.
2,Abandon,"Marcus watched his older brother <blank> their childhood dream of opening a restaurant together, choosing instead to pursue a career in law."
2,Abandon,"The wildlife sanctuary refused to <blank> the injured owl, nursing it back to health despite the significant cost and effort required."
2,Abandon,"When the earthquake struck, residents had mere minutes to <blank> their homes and flee to higher ground."
2,Abandon,The author's decision to <blank> her unfinished manuscript came after years of writer's block and self-doubt.
2,Abandon,"Rather than <blank> hope after the disappointing test results, Dr. Chen proposed a completely different treatment approach."
2,Abashed,"When the teacher praised his essay in front of the entire class, Timothy felt <blank> and his cheeks turned bright red."
2,Abashed,Catherine looked <blank> when she realised she had been singing loudly along to her headphones on the crowded train.
2,Abashed,The usually confident barrister appeared genuinely <blank> after mispronouncing the defendant's name three times in succession.
2,Abashed,"Finding himself caught in a lie about his whereabouts, James stood there looking thoroughly <blank> and unable to meet anyone's eyes."
2,Abashed,Emma felt <blank> when her grandmother revealed that she'd overheard her complaining about the knitted jumper she'd received as a gift.
2,Abashed,The renowned chef looked somewhat <blank> when a young apprentice politely corrected his technique for making béarnaise sauce.
2,Abashed,"After accidentally sending a text criticising her boss to her boss instead of her friend, Sophie felt utterly <blank>."
2,Abashed,The politician appeared <blank> when a journalist quoted his contradictory statements from previous interviews back to him.
2,Abashed,Daniel felt <blank> when he realised the woman he'd been lecturing about local history was actually the museum curator.
2,Abashed,The children looked <blank> when their elaborate plan to surprise their mother was discovered before her birthday.
2,Absence,The sudden <blank> of birdsong in the garden made Eleanor suspect that a predator was lurking nearby.
2,Absence,"After three weeks of unexplained <blank> from work, Mr. Patterson's colleagues began to worry about his wellbeing."
2,Absence,The complete <blank> of evidence at the crime scene puzzled the forensic team and suggested professional involvement.
2,Absence,"During his month-long <blank> from school, Oliver missed the entire unit on trigonometry and struggled to catch up."
2,Absence,The notable <blank> of the company director from the crucial board meeting raised questions about her commitment to the merger.
2,Absence,Dr. Sharma's temporary <blank> from the surgery meant that patients had to wait longer for specialist appointments.
2,Absence,The conspicuous <blank> of any apology in his statement only fuelled the public's anger about the scandal.
2,Absence,"In the <blank> of clear instructions from headquarters, the regional manager had to make critical decisions independently."
2,Absence,The child's prolonged <blank> from her best friend's birthday party was noticed by everyone and required explanation.
2,Absence,The striking <blank> of modern technology in the remote village felt like stepping back in time fifty years.
2,Absolute,The mountaineering expedition required <blank> silence during the avalanche risk assessment to detect any threatening sounds.
2,Absolute,Her <blank> refusal to compromise on safety standards earned her both respect and criticism from different colleagues.
2,Absolute,The headmaster demanded <blank> honesty from students about who had vandalised the science laboratory equipment.
2,Absolute,"In <blank> darkness of the cave, the explorers had to rely entirely on their torches to navigate the narrow passages."
2,Absolute,"The duchess exercised <blank> control over her estate's management, making every significant decision personally."
2,Absolute,The restaurant critic's <blank> praise for the new chef's innovative menu was unprecedented in her thirty-year career.
2,Absolute,"The barrister's <blank> confidence in her client's innocence never wavered, even when new evidence emerged."
2,Absolute,"The ancient monastery required <blank> silence during meditation hours, with even whispers strictly forbidden."
2,Absolute,The scientist's findings provided <blank> proof that the previous theory had been fundamentally flawed all along.
2,Absolute,"After years of uncertainty, the DNA test results gave the family <blank> certainty about their ancestry."
2,Absorbed,Lily became so <blank> in her novel that she didn't notice her train had reached her stop and continued past it.
2,Absorbed,"The sponge quickly <blank> the spilled juice from the kitchen counter, leaving no trace of the accident."
2,Absorbed,"Throughout the lecture, the students remained completely <blank>, hanging on every word of the visiting professor's fascinating stories."
2,Absorbed,"The desert sand <blank> the rainwater within minutes, leaving little evidence of the brief but intense storm."
2,Absorbed,"Henry sat <blank> at his desk, concentrating so intently on solving the mathematical puzzle that he forgot about lunch."
2,Absorbed,"The roots of the ancient oak had <blank> all the nutrients from the surrounding soil, preventing other plants from growing nearby."
2,Absorbed,"Sophie found herself completely <blank> by the street musician's haunting melody, standing transfixed for nearly an hour."
2,Absorbed,"The black fabric <blank> the sunlight and heat, making the car interior uncomfortably warm on the summer afternoon."
2,Absorbed,"The children watched <blank> as the magician performed increasingly impossible tricks, their eyes wide with wonder."
2,Absorbed,"The scandal <blank> all the media's attention that week, pushing other important news stories completely off the front pages."
2,Abstract,The philosophy professor's lecture on consciousness was so <blank> that even the brightest students struggled to grasp the concepts.
2,Abstract,Young children often find it difficult to understand <blank> concepts like justice or time until they mature cognitively.
2,Abstract,The artist's latest exhibition featured <blank> paintings that left viewers debating what each piece might represent.
2,Abstract,"For her dissertation, Margaret had to <blank> the key findings from hundreds of research papers into a comprehensive summary."
2,Abstract,"The architect's initial designs were too <blank> and theoretical, lacking the practical details needed for actual construction."
2,Abstract,The mathematician worked with <blank> theories that had no immediate practical application but advanced pure understanding.
2,Abstract,Politicians often speak in <blank> terms about 'freedom' and 'values' rather than addressing specific policy proposals.
2,Abstract,"The composer's experimental piece was deliberately <blank>, avoiding any recognisable melody or traditional musical structure."
2,Abstract,"To make his scientific paper accessible, Dr. Wells had to <blank> complex data into simplified key points."
2,Abstract,The debate moved from concrete examples to increasingly <blank> philosophical arguments about the nature of reality itself.
2,Abstruse,The professor's explanation of quantum mechanics was so <blank> that even his graduate students requested a simpler version.
2,Abstruse,The ancient manuscript contained <blank> references to forgotten rituals that modern scholars found nearly impossible to interpret.
2,Abstruse,"Despite reading the legal document three times, Margaret found the contract's language deliberately <blank> and obscure."
2,Abstruse,"The poet's later work became increasingly <blank>, abandoning accessible imagery for complex allusions only specialists appreciated."
2,Abstruse,The philosopher's <blank> arguments about epistemology made sense only to those with extensive background in the field.
2,Abstruse,The tax code's <blank> provisions regarding foreign investments required hiring a specialist accountant to navigate properly.
2,Abstruse,Critics complained that the author's brilliant insights were buried beneath unnecessarily <blank> prose and obscure terminology.
2,Abstruse,"The technical manual's <blank> instructions for installing the software frustrated users who simply wanted clear, simple steps."
2,Abstruse,The medieval alchemist's notes were so <blank> that modern chemists debated whether they described real experiments or mystical nonsense.
2,Abstruse,"Rather than clarifying matters, the government spokesperson's <blank> explanation only deepened the public's confusion about the policy."
2,Abysmal,The restaurant's service was so <blank> that customers waited forty minutes just to receive menus from the distracted staff.
2,Abysmal,"Despite months of practice, Gerald's performance at the piano recital was <blank>, with wrong notes in nearly every bar."
2,Abysmal,The team's <blank> defensive play allowed their opponents to score six goals in the first half alone.
2,Abysmal,The company's <blank> safety record resulted in government inspectors shutting down the factory pending major improvements.
2,Abysmal,"The film received <blank> reviews from critics, with several calling it the worst release of the entire year."
2,Abysmal,"Working conditions in the Victorian factory were <blank>, with children labouring fourteen hours daily in dangerous circumstances."
2,Abysmal,The student's <blank> attendance record—present for only twelve days all term—made passing the course virtually impossible.
2,Abysmal,The council's <blank> handling of the flooding crisis left hundreds of families without proper support for weeks.
2,Abysmal,The hotel's <blank> standards of cleanliness prompted health inspectors to threaten immediate closure unless improvements were made.
2,Abysmal,"After three <blank> years of declining sales and mounting debts, the business finally declared bankruptcy."
2,Accolade,The young novelist received the highest <blank> in British literature when she won the prestigious Booker Prize.
2,Accolade,"After thirty years of dedication to marine conservation, Dr. Morrison finally received the international <blank> her work deserved."
2,Accolade,The chef considered a favourable review from the notoriously critical food writer to be the ultimate professional <blank>.
2,Accolade,Receiving an <blank> from the Queen for services to education was the proudest moment of the headmistress's career.
2,Accolade,"The film swept the awards ceremony, collecting every major <blank> including best picture, director, and screenplay."
2,Accolade,The scientist's groundbreaking research on climate change earned her numerous <blank> from institutions worldwide.
2,Accolade,Being invited to conduct at the Royal Albert Hall was an <blank> that confirmed Marcus's status among Britain's finest musicians.
2,Accolade,"The veteran actress brushed aside the latest <blank>, insisting that good work itself was reward enough."
2,Accolade,The architect's innovative design received the highest <blank> from the Royal Institute of British Architects.
2,Accolade,"Despite winning countless <blank> throughout his career, the humble professor claimed his students' success mattered most."
2,Accustom,"After living in London for six months, Hiroshi began to <blank> himself to the constant noise and crowds of city life."
2,Accustom,The puppy needed time to <blank> itself to its new home before introducing it to other family pets.
2,Accustom,The doctor advised Margaret to gradually <blank> her eyes to wearing contact lenses rather than switching abruptly from spectacles.
2,Accustom,"Moving from coastal Cornwall to the Midlands, the family struggled to <blank> themselves to being so far from the sea."
2,Accustom,The boot camp's purpose was to <blank> new recruits to military discipline and the demands of service life.
2,Accustom,It took weeks for Professor Chen to <blank> herself to lecturing in English after teaching in Mandarin for twenty years.
2,Accustom,The coach worked to <blank> the team to playing on artificial turf before their crucial away match.
2,Accustom,"After retirement, Robert found it difficult to <blank> himself to having unstructured days with no work obligations."
2,Accustom,The theatre director tried to <blank> the nervous young actress to performing before large audiences through gradual exposure.
2,Accustom,Living in Scotland meant the Australian exchange student had to <blank> herself to dramatically shorter winter days and longer darkness.
2,Acerbic,The theatre critic's <blank> review described the musical as 'a tortuous assault on both ears and intelligence' that left the cast devastated.
2,Acerbic,"Margaret's <blank> wit could slice through pretension like a knife, leaving pompous colleagues squirming uncomfortably at dinner parties."
2,Acerbic,The food blogger's <blank> commentary on the restaurant's 'tragic interpretation of Yorkshire pudding' went viral within hours.
2,Acerbic,His <blank> tone when discussing his ex-wife's new husband revealed years of unresolved bitterness and resentment.
2,Acerbic,"The novelist was known for her <blank> dialogue that captured the sharp, cutting remarks people make when relationships disintegrate."
2,Acerbic,"Professor Hartley's <blank> feedback on essays often reduced students to tears, though it invariably improved their writing dramatically."
2,Acerbic,The politician's <blank> dismissal of her opponent's proposal—calling it 'infantile nonsense from someone clearly out of their depth'—shocked viewers.
2,Acerbic,James regretted his <blank> comment about his sister's cooking the moment he saw her wounded expression across the table.
2,Acerbic,The comedian's <blank> observations about modern life were hilarious but left some audience members feeling uncomfortably exposed.
2,Acerbic,Catherine's <blank> response to her neighbour's complaint—'Perhaps if you spent less time spying and more time parenting'—ended their friendship permanently.
2,Acronym,The new employee felt overwhelmed when colleagues kept using the <blank> 'GDPR' without explaining it meant General Data Protection Regulation.
2,Acronym,"Dr. Sanders had to remind himself that NASA was an <blank> standing for National Aeronautics and Space Administration, not simply a word."
2,Acronym,The hospital's extensive use of medical <blank> like 'CT' and 'MRI' left patients confused during consultations with specialists.
2,Acronym,"In her presentation, Rebecca explained that 'radar' began as an <blank> for 'radio detection and ranging' before becoming a standard word."
2,Acronym,The Ministry's obsession with creating an <blank> for every initiative resulted in confusing labels like 'SPRITE' and 'FALCON' that nobody could remember.
2,Acronym,"When Timothy asked what 'scuba' meant, his diving instructor explained it was an <blank> for 'self-contained underwater breathing apparatus'."
2,Acronym,The teenage girls invented their own <blank>—'FOMO' for 'fear of missing out'—which quickly spread through social media platforms.
2,Acronym,"The report was incomprehensible, filled with technical <blank> that assumed readers already understood the Defence Ministry's internal jargon."
2,Acronym,Professor Williams traced how 'laser' evolved from an <blank> for 'light amplification by stimulated emission of radiation' into everyday vocabulary.
2,Acronym,"The recruits had to memorise dozens of military <blank> during basic training, from 'NCO' to 'AWOL', before they could understand orders."
2,Adamant,"Despite her family's pleading, Grandmother remained <blank> that she would not sell the farmhouse where she had lived for sixty years."
2,Adamant,"The headmaster was <blank> about maintaining the school's traditional uniform policy, refusing to consider the students' petition for changes."
2,Adamant,"Susan's <blank> refusal to apologise for speaking the truth cost her the promotion, but she never regretted her decision."
2,Adamant,"The surgeon remained <blank> that operating immediately was too dangerous, despite the patient's desperate family demanding immediate action."
2,Adamant,"Thomas was <blank> that he had locked the front door, yet somehow the burglars had entered without forcing any entry points."
2,Adamant,"The council proved <blank> in their decision to demolish the Victorian building, ignoring the architects' pleas and historical society protests."
2,Adamant,"Eleanor's father was <blank> that she could not attend university in London, fearing the city would corrupt his innocent daughter."
2,Adamant,The detective remained <blank> about his theory even when new evidence seemed to contradict his conclusions about the robbery.
2,Adamant,"Despite mounting debts, Richard stayed <blank> that his business would succeed, pouring his remaining savings into the failing venture."
2,Adamant,"The elderly artist was <blank> that her paintings must never be sold commercially, wanting them donated to public galleries instead."
2,Advance,"The general ordered his troops to <blank> cautiously through the dense forest, knowing the enemy had laid numerous traps along the path."
2,Advance,Sarah's career began to <blank> rapidly after she successfully negotiated the merger that saved the company from bankruptcy.
2,Advance,The scientists could not <blank> their research without additional funding from government sources willing to support controversial work.
2,Advance,Wellington's army managed to <blank> across the muddy battlefield despite fierce resistance from Napoleon's entrenched defensive positions.
2,Advance,"The publisher offered Margaret a substantial <blank> payment for her novel before it was even completed, showing confidence in her talent."
2,Advance,"As storm clouds gathered overhead, the hiking group decided to <blank> quickly toward the shelter rather than setting up camp."
2,Advance,Technology continues to <blank> at a pace that leaves regulators struggling to create appropriate laws for emerging ethical dilemmas.
2,Advance,The chess player studied her opponent's position carefully before deciding which pieces to <blank> toward his vulnerable king.
2,Advance,Dr. Patel's revolutionary technique represented a significant <blank> in surgical procedures for treating previously inoperable brain tumours.
2,Advance,"The protest march began to <blank> down Whitehall toward Parliament, with thousands of demonstrators chanting slogans about climate action."
2,Aggressor,The playground supervisor identified Marcus as the <blank> after three witnesses confirmed he had started the fight deliberately.
2,Aggressor,"In the war crimes tribunal, prosecutors struggled to prove which nation had been the initial <blank> when hostilities first erupted."
2,Aggressor,The security footage clearly showed that the shopkeeper had acted in self-defence rather than being the <blank> in the altercation.
2,Aggressor,The divorce proceedings became complicated when both parties accused each other of being the primary <blank> in the relationship's breakdown.
2,Aggressor,"At the international summit, diplomats worked to isolate the <blank> nation through economic sanctions and diplomatic pressure."
2,Aggressor,"The documentary examined how historical narratives are written by victors, often obscuring which side was truly the original <blank>."
2,Aggressor,"In the territorial dispute, both countries claimed the other was the <blank>, making neutral mediation virtually impossible."
2,Aggressor,The police report identified the dog owner's negligence rather than the animal itself as the <blank> in the incident.
2,Aggressor,Corporate lawyers advised their client to settle quietly rather than be publicly identified as the <blank> in the harassment case.
2,Aggressor,The United Nations investigation aimed to determine the <blank> in the border conflict that had displaced thousands of refugees.
2,Ailment,The Victorian doctor diagnosed his patient with a mysterious <blank> that caused debilitating fatigue and unexplained joint pain.
2,Ailment,"Grandmother dismissed her persistent cough as merely a minor <blank>, refusing to visit the surgery until her daughter insisted."
2,Ailment,"The village healer claimed her herbal remedies could cure any <blank>, from common colds to more serious digestive disorders."
2,Ailment,"After months of tests, the specialist finally identified the rare <blank> responsible for Oliver's progressive vision loss."
2,Ailment,The insurance company refused to cover treatment for what they classified as a pre-existing <blank> from before the policy began.
2,Ailment,Dr. Morrison suspected his patient's vague symptoms indicated an underlying <blank> rather than simple stress as previously diagnosed.
2,Ailment,The tropical <blank> that swept through the expedition camp left half the researchers too ill to continue their work.
2,Ailment,"Elizabeth's recurring <blank> had plagued her since childhood, causing painful episodes that required increasingly strong medication."
2,Ailment,The occupational health nurse noted that the mysterious <blank> affecting factory workers might be linked to chemical exposure.
2,Ailment,"Despite suffering from a chronic <blank> that caused constant discomfort, the elderly professor never missed a single lecture."
2,Alienate,The company director's arrogant behaviour began to <blank> key clients who took their business to more respectful competitors.
2,Alienate,"Margaret's constant criticism of her daughter's choices threatened to <blank> the girl completely, driving her toward estranged relatives."
2,Alienate,The politician's inflammatory remarks about immigration managed to <blank> both progressive voters and moderate conservatives simultaneously.
2,Alienate,"Robert's obsessive dedication to his research started to <blank> his wife, who felt increasingly like an unwelcome distraction."
2,Alienate,The headmaster's rigid enforcement of petty rules served only to <blank> students who might otherwise have respected his authority.
2,Alienate,Catherine worried that her strong religious views would <blank> her university friends who held different philosophical perspectives.
2,Alienate,The author's decision to radically change her writing style in the new book risked <blank> loyal readers who loved her previous work.
2,Alienate,James discovered too late that his sarcastic sense of humour tended to <blank> colleagues rather than endear him to them.
2,Alienate,The council's plan to demolish the community centre would <blank> residents who viewed it as the neighbourhood's heart.
2,Alienate,"Eleanor's parents' constant interference in her marriage was beginning to <blank> her husband, creating dangerous tension in the relationship."
2,Alleviate,The doctor prescribed strong painkillers to <blank> the severe discomfort following the patient's complicated dental surgery.
2,Alleviate,The government's emergency fund aimed to <blank> the financial burden on families struggling with rising energy costs.
2,Alleviate,Dr. Chen hoped that her research into new therapies might <blank> the suffering of patients with chronic inflammatory conditions.
2,Alleviate,The charity's food distribution programme helped <blank> hunger in the impoverished district during the harsh winter months.
2,Alleviate,Margaret found that gentle yoga exercises could <blank> her persistent back pain more effectively than expensive physiotherapy sessions.
2,Alleviate,The council planted thousands of trees to <blank> the urban heat island effect making city summers unbearably hot.
2,Alleviate,The mediator's calm intervention managed to <blank> the tensions between the feuding neighbours before violence erupted.
2,Alleviate,The headmaster introduced flexible deadlines to <blank> the anxiety students experienced during examination periods.
2,Alleviate,Installing proper drainage systems would <blank> the flooding that plagued the village every time heavy rain fell.
2,Alleviate,The nurse used cold compresses to <blank> the burning sensation from the patient's severe sunburn.
2,Alluring,The mysterious stranger's <blank> smile suggested secrets and adventures that made sensible Sarah consider abandoning her careful life.
2,Alluring,Venice at sunset presented an <blank> vision of golden light on ancient buildings that entranced even the most jaded tourists.
2,Alluring,The con artist's <blank> proposition of guaranteed returns attracted investors who should have known better than to trust such promises.
2,Alluring,Catherine found her colleague's <blank> combination of confidence and vulnerability dangerously attractive despite her engagement.
2,Alluring,The advertisement painted an <blank> picture of tropical beaches and luxury that bore little resemblance to the actual resort.
2,Alluring,The orchestra's <blank> performance of the haunting melody drew the audience into a spell-like state of rapt attention.
2,Alluring,"James resisted the <blank> temptation to abandon his stable career for the risky startup opportunity, though the offer haunted him."
