level,word,quiz_sentence
2,Barbarian,"The playwright's new drama featured a Roman general who falls in love with a <blank> queen, challenging his prejudices about civilisation."
2,Barbarian,"In his history thesis, James argued that the term <blank> revealed more about Roman xenophobia than it did about the people they conquered."
2,Barbarian,The fantasy novel's hero was raised by <blank> warriors who taught him survival skills that later saved his kingdom.
2,Barbarian,"During the debate, the professor explained how ancient Greeks used the word <blank> to describe anyone who didn't speak their language."
2,Barbarian,The archaeological evidence suggested that the so-called <blank> invaders actually brought advanced metalworking techniques to the region.
2,Barbarian,"In her comparative literature course, Sarah examined how medieval texts portrayed Vikings as <blank>, ignoring their sophisticated navigation and trade networks."
2,Barricade,"During the protest, demonstrators used overturned lorries and wooden pallets to <blank> the entrance to Parliament, preventing MPs from entering."
2,Barricade,"The flood defences couldn't hold back the rising Thames, so residents frantically tried to <blank> their doorways with sandbags."
2,Barricade,"In the historical novel, revolutionaries spent the night building a <blank> from cobblestones and furniture, preparing for the morning assault."
2,Barricade,"After the zombie outbreak in the film, survivors used abandoned cars to <blank> the high street, creating a safe corridor to the hospital."
2,Barricade,The security team decided to <blank> the backstage area with metal barriers after fans breached the perimeter at the last concert.
2,Barricade,"When the police arrived at the siege, they found that the suspect had used bookcases and mattresses to <blank> himself inside the flat."
2,Barricade,The medieval castle's defenders would <blank> the breach in the wall with whatever materials they could find during prolonged sieges.
2,Barricade,"During the riots, shopkeepers desperately tried to <blank> their windows with wooden boards, hoping to protect their livelihoods."
2,Barricade,"In her memoir of the war years, grandmother described how neighbours helped each other <blank> damaged buildings to create makeshift shelters."
2,Barricade,The mountain rescue team had to <blank> the unstable trail with safety barriers before allowing hikers to pass through the avalanche zone.
2,Beautiful,The sunset over the Cornish cliffs was so <blank> that Sarah abandoned her phone and simply watched the sky turn from gold to crimson.
2,Beautiful,"Critics declared the architect's design for the new library <blank>, praising its seamless integration of glass and Victorian brickwork."
2,Beautiful,"Though the old cottage garden was overgrown and wild, there was something undeniably <blank> about its chaotic abundance of roses and hollyhocks."
2,Beautiful,"The soprano's voice was so <blank> that the entire cathedral fell silent, every listener transfixed by the haunting melody."
2,Beautiful,"After years of drought, the farmers wept at the <blank> sight of dark clouds gathering over the parched fields."
2,Beautiful,"The mathematician's proof was considered <blank> by her colleagues, its elegant simplicity solving a problem that had puzzled researchers for decades."
2,Beautiful,"In the documentary, the marine biologist described the <blank> complexity of the coral reef ecosystem, calling it more intricate than any human city."
2,Beautiful,"The poet's final collection captured <blank> moments from ordinary life, transforming mundane bus journeys into profound reflections."
2,Beautiful,"Despite the mansion's grandeur, Elizabeth found her grandmother's small cottage in the Highlands far more <blank>, with its stone walls covered in lichen and moss."
2,Beautiful,"The restoration team revealed the cathedral's <blank> medieval frescoes, hidden beneath centuries of whitewash and grime."
2,Becoming,"The simple black dress was perfectly <blank> for the embassy dinner, sophisticated without being ostentatious."
2,Becoming,"After months of diplomatic training, Marcus finally learned the <blank> way to address foreign dignitaries without causing offence."
2,Becoming,The judge remarked that such aggressive behaviour was not <blank> of a barrister who claimed to respect the court's procedures.
2,Becoming,"In her etiquette column, Lady Pemberton advised that excessive jewellery at afternoon tea was most un<blank> of a proper hostess."
2,Becoming,The headmaster insisted that the sixth-formers maintain standards of conduct <blank> their position as role models for younger students.
2,Becoming,Critics argued that the minister's casual remarks about poverty were hardly <blank> someone responsible for the welfare budget.
2,Becoming,"At finishing school, Charlotte learned what was considered <blank> behaviour for a young woman of her social standing in Victorian society."
2,Becoming,The regiment's colonel declared that cowardice was not <blank> of soldiers who wore the Queen's uniform.
2,Becoming,"In the period drama, the duchess struggled to behave in a manner <blank> her station whilst secretly plotting rebellion."
2,Becoming,The biography revealed that Gandhi's simple lifestyle was entirely <blank> his philosophy of non-materialistic leadership.
2,Belittle,"Throughout the meeting, the senior partner seemed determined to <blank> Jessica's contributions, dismissing her research as 'interesting but hardly groundbreaking'."
2,Belittle,"In his memoirs, the actor described how directors would constantly <blank> his theatrical training, insisting that film required no real skill."
2,Belittle,The teacher's tendency to <blank> students who asked questions created an atmosphere where nobody dared speak up during lessons.
2,Belittle,"Despite her brother's attempts to <blank> her achievements, Sarah knew that winning the mathematics competition was a genuine accomplishment."
2,Belittle,The documentary exposed how the tobacco industry tried to <blank> scientific evidence linking smoking to cancer for decades.
2,Belittle,"At family gatherings, Uncle Robert would invariably <blank> modern art, declaring that 'anyone could splash paint on a canvas'."
2,Belittle,The opposition leader accused the Prime Minister of trying to <blank> the severity of the economic crisis during yesterday's debate.
2,Belittle,"In the novel, the villain's strategy was to systematically <blank> the hero's confidence before launching his final attack."
2,Belittle,The museum curator refused to <blank> the importance of preserving everyday objects alongside priceless antiquities.
2,Belittle,"During the court case, the defendant's barrister attempted to <blank> the witness's testimony by questioning her educational background."
2,Bellicose,The ambassador's increasingly <blank> rhetoric alarmed diplomats who feared his inflammatory speeches might actually provoke war.
2,Bellicose,"In the pub, the <blank> football fan kept shouting aggressive taunts at supporters of the rival team until security escorted him out."
2,Bellicose,The prime minister's <blank> response to the border incident surprised analysts who had expected a more measured diplomatic approach.
2,Bellicose,"During the debate, Professor Williams abandoned his usual academic tone and became surprisingly <blank>, attacking his opponent's credentials rather than their arguments."
2,Bellicose,"The medieval baron was notorious for his <blank> temperament, always eager to settle disputes through combat rather than negotiation."
2,Bellicose,Critics worried that the newspaper's <blank> editorials about immigration were deliberately stoking public anger to increase circulation.
2,Bellicose,"At the shareholders' meeting, the <blank> hedge fund manager threatened hostile takeovers if the board didn't accept his demands immediately."
2,Bellicose,The novel's protagonist transforms from a peace-loving scholar into a <blank> warrior after witnessing the destruction of his village.
2,Bellicose,The opposition party's <blank> stance on foreign policy contrasted sharply with the government's preference for diplomatic solutions.
2,Bellicose,"In the documentary, historians examined how <blank> propaganda posters in 1914 successfully recruited millions of volunteers for the trenches."
2,Bemused,"The elderly professor stood <blank> in the middle of the electronics shop, utterly perplexed by the array of smartphones and tablets."
2,Bemused,"Sarah watched with a <blank> expression as her teenage daughter explained TikTok trends, unable to comprehend why anyone would film themselves dancing."
2,Bemused,The tourists looked thoroughly <blank> when the tour guide announced they'd be eating haggis for dinner at the Highland castle.
2,Bemused,"After reading his grandson's text message full of abbreviations and emojis, Grandfather sat <blank>, wondering when English had become so incomprehensible."
2,Bemused,The committee members appeared <blank> when the treasurer revealed that the village fête had somehow made a loss despite record attendance.
2,Bemused,"During the modern art exhibition, most visitors wandered through <blank>, puzzled by installations that seemed to consist of empty rooms."
2,Bemused,The barrister's <blank> reaction to the witness's contradictory testimony suggested he couldn't quite believe what he was hearing.
2,Bemused,"In the film, the time traveller stands <blank> in Piccadilly Circus, completely bewildered by the neon advertisements and traffic."
2,Bemused,The journalist looked increasingly <blank> as the politician answered every question without actually addressing any of the points raised.
2,Bemused,"When the waiter presented the bill for two coffees at the airport café, the couple sat <blank>, certain there must be some mistake."
2,Benefit,"The charity gala raised over £200,000 to <blank> children's hospitals across the north of England, exceeding all expectations."
2,Benefit,"After the factory closure, many families had to rely on state <blank> to survive whilst searching for new employment."
2,Benefit,"The new cycle lanes would <blank> not just cyclists but also drivers, reducing traffic congestion throughout the city centre."
2,Benefit,"In his will, the industrialist arranged for substantial <blank> payments to all employees who had served the company for over twenty years."
2,Benefit,The agricultural reforms would primarily <blank> small tenant farmers rather than wealthy landowners who already enjoyed significant advantages.
2,Benefit,The community theatre organised a <blank> performance to raise funds for repairing the church roof damaged in last winter's storms.
2,Benefit,Research suggested that the new teaching methods would particularly <blank> pupils from disadvantaged backgrounds who struggled with traditional approaches.
2,Benefit,"The cricket club held an annual <blank> match, donating all proceeds to the local hospice that had cared for the founder's wife."
2,Benefit,Legal experts debated whether the proposed legislation would genuinely <blank> consumers or simply create more bureaucratic obstacles.
2,Benefit,The National Trust demonstrated how conservation efforts <blank> not only wildlife but also tourism revenues in rural communities.
2,Bequeath,"In her will, Lady Hartington chose to <blank> her extensive art collection to the National Gallery rather than to her estranged children."
2,Bequeath,"The dying novelist announced he would <blank> all manuscript drafts to the Bodleian Library, ensuring scholars could study his creative process."
2,Bequeath,"Upon his death, the eccentric millionaire decided to <blank> his entire fortune to his three cats, leaving distant relatives utterly furious."
2,Bequeath,"The medieval charter allowed monasteries to <blank> property to the Church, creating vast ecclesiastical estates that lasted for centuries."
2,Bequeath,"In the historical drama, the king's decision to <blank> the throne to his illegitimate son sparked a devastating civil war."
2,Bequeath,"Great-uncle Geoffrey had promised to <blank> his vintage car collection to Thomas, who had spent every summer helping restore the vehicles."
2,Bequeath,The industrialist's decision to <blank> his factory to the workers as a cooperative was considered revolutionary in Victorian England.
2,Bequeath,"According to Roman law, citizens could <blank> property to adopted heirs with the same legal standing as biological children."
2,Bequeath,The composer arranged to <blank> royalties from his symphonies to the music conservatory where he had studied as a young man.
2,Bequeath,"In the novel, the grandmother refuses to <blank> her recipe book to anyone, taking her culinary secrets to the grave."
2,Besieged,"For three months, the defenders held the <blank> castle, surviving on rats and rainwater whilst waiting for reinforcements that never came."
2,Besieged,"After the scandal broke, the minister's office was <blank> by journalists demanding answers about the misuse of public funds."
2,Besieged,"During the medieval period, the <blank> city of Constantinople held out against Ottoman forces for fifty-three days before finally falling."
2,Besieged,"The headmistress felt thoroughly <blank> by angry parents, all demanding explanations for the sudden changes to the examination timetable."
2,Besieged,"In the documentary, survivors described life in the <blank> Sarajevo, where collecting water or bread meant risking sniper fire."
2,Besieged,The customer service department was <blank> with complaints after the airline cancelled hundreds of flights during the bank holiday weekend.
2,Besieged,"The novel's climax occurs when the <blank> fortress runs out of ammunition, forcing defenders to fight with medieval weapons."
2,Besieged,"After the celebrity's controversial tweet, their publicist's phone was <blank> with calls from tabloid newspapers and television producers."
2,Besieged,The archaeological dig revealed that the <blank> settlement had developed sophisticated tunnel systems for smuggling in supplies.
2,Besieged,"When the restaurant received a Michelin star, the reservation line was immediately <blank> by food enthusiasts desperate to book tables."
2,Beverage,"After the long cricket match under the scorching sun, the players gathered in the pavilion to enjoy a cold <blank> before heading home."
2,Beverage,"The café on the corner specialised in exotic teas and coffees, offering every imaginable <blank> from around the world to its discerning customers."
2,Beverage,"During the elegant garden party, waiters in white gloves circulated amongst the guests carrying silver trays laden with champagne and other refined <blank>s."
2,Beverage,"The old pub's menu featured traditional British ales and ciders, each <blank> carefully selected by the landlord himself from local breweries."
2,Beverage,"At the formal dinner, the sommelier recommended pairing each course with an appropriate <blank>, from sparkling wine to aged port."
2,Beverage,"The airline attendant pushed the trolley down the aisle, offering passengers a complimentary <blank> of their choice during the transatlantic flight."
2,Beverage,"In the hotel's breakfast room, guests could help themselves to orange juice, tea, coffee, or any other <blank> from the extensive selection."
2,Beverage,The vending machine in the hospital corridor dispensed hot <blank>s twenty-four hours a day for visitors and night-shift staff.
2,Beverage,"During Ramadan, the family would break their fast at sunset with dates and a refreshing <blank> before the evening meal."
2,Beverage,"The mountaineering expedition packed freeze-dried meals and water purification tablets, as finding a safe <blank> at high altitude was crucial for survival."
2,Bewilder,The labyrinthine streets of the medieval town centre continued to <blank> tourists despite the new signage installed by the council.
2,Bewilder,"When Professor Thompson presented his groundbreaking theorem, the complex mathematical equations seemed to <blank> even his most brilliant students."
2,Bewilder,"The magician's elaborate trick with the disappearing cabinet never failed to <blank> the audience, leaving them gasping in amazement."
2,Bewilder,"After waking from the accident with no memory of the past three years, the unfamiliar surroundings and faces began to <blank> Sarah completely."
2,Bewilder,"The contradictory instructions in the furniture assembly manual managed to <blank> even Henry, who prided himself on his practical skills."
2,Bewilder,"During her first week at the London Underground, the maze of interconnecting tunnels and platforms would thoroughly <blank> Emma every morning."
2,Bewilder,"The witness's testimony at the Old Bailey seemed designed to <blank> the jury, as she changed crucial details with each telling."
2,Bewilder,The sudden plot twists in the detective novel were carefully crafted to <blank> readers until the very last chapter revealed the truth.
2,Bewilder,"When the experienced hiker found himself surrounded by identical-looking pine trees in the fog, panic began to <blank> his usually calm mind."
2,Bewilder,The opposing barrister's rapid-fire questions and legal jargon appeared calculated to <blank> the defendant during cross-examination.
2,Biased,"The newspaper's coverage of the election was clearly <blank>, consistently portraying one candidate in glowing terms whilst attacking the other."
2,Biased,"As a lifelong Manchester United supporter, Derek admitted he might be somewhat <blank> when discussing his team's chances in the Premier League."
2,Biased,The judge declared a mistrial after discovering that one juror had been <blank> against the defendant due to a previous unrelated encounter.
2,Biased,Professor Mitchell's research methodology was criticised for being <blank> towards results that supported her initial hypothesis rather than objective findings.
2,Biased,The documentary about climate change was accused of presenting a <blank> viewpoint by interviewing only scientists who supported one particular theory.
2,Biased,"During the custody hearing, the social worker strived to remain impartial, though her report appeared slightly <blank> in favour of the mother."
2,Biased,"The restaurant critic's review seemed suspiciously <blank>, praising every aspect of his brother-in-law's new establishment without mentioning any flaws."
2,Biased,"After the referee made several questionable decisions against the visiting team, the manager accused him of being <blank> towards the home side."
2,Biased,The hiring committee was trained to recognise <blank> thinking that might unfairly disadvantage qualified candidates from diverse backgrounds.
2,Biased,"When evaluating the two proposals, the board members tried to set aside their <blank> preferences and focus solely on the merits of each plan."
2,Blasphemy,"In the conservative village, the artist's painting depicting religious figures in a modern setting was condemned as outrageous <blank> by the parish council."
2,Blasphemy,The medieval manuscript described how those accused of <blank> against the church were often subjected to severe punishments during the Inquisition.
2,Blasphemy,"During the heated theological debate at Oxford, the young scholar's radical reinterpretation of scripture was denounced as dangerous <blank> by traditionalists."
2,Blasphemy,"The comedian's routine about organised religion sparked protests outside the theatre, with demonstrators carrying signs accusing him of <blank>."
2,Blasphemy,"In certain countries, laws against <blank> remain on the statute books, though they are rarely enforced in modern times."
2,Blasphemy,The historical novel depicted a time when uttering any criticism of the king's divine right to rule was considered treasonous <blank>.
2,Blasphemy,"At the interfaith conference, speakers emphasised the importance of respectful dialogue whilst acknowledging that one religion's truth might be considered <blank> by another."
2,Blasphemy,The philosopher's assertion that morality existed independently of religious authority was viewed as shocking <blank> by his 17th-century contemporaries.
2,Blasphemy,"When the bishop heard the priest's unorthodox sermon questioning fundamental doctrine, he privately summoned him to discuss the matter of potential <blank>."
2,Blasphemy,"The author's controversial book was banned in several regions, with religious leaders claiming it contained deliberate <blank> intended to offend the faithful."
2,Blissful,"After three exhausting years completing her medical degree, Catherine spent a <blank> fortnight at her grandmother's cottage in the Cotswolds, doing absolutely nothing."
2,Blissful,The couple's honeymoon in the Maldives was a <blank> escape from the stress of wedding planning and their demanding careers in the City.
2,Blissful,"In his retirement, grandfather lived in <blank> contentment, tending his roses and spending long afternoons reading in his favourite armchair."
2,Blissful,"The newborn slept in <blank> ignorance of the chaos surrounding the house move, whilst his parents frantically packed boxes around him."
2,Blissful,Walking through the sun-dappled forest on that perfect spring morning filled Eleanor with a <blank> sense of peace she hadn't felt in years.
2,Blissful,"The spa weekend offered a <blank> retreat from London life, complete with massage treatments, thermal baths, and absolute silence."
2,Blissful,"During the first few weeks with their adopted daughter, the family existed in a <blank> bubble, learning to love one another without outside interference."
2,Blissful,"The elderly woman smiled in <blank> recollection of her youth, remembering summer days that seemed to last forever in the Welsh valleys."
2,Blissful,"After the successful surgery removed his chronic pain, David experienced a <blank> relief that transformed his entire outlook on life."
2,Blissful,The children played in <blank> unawareness that their parents were discussing the family's imminent move to Edinburgh in the next room.
2,Bludgeon,"The detective examined the victim's injuries and concluded that the attacker had used a heavy <blank>, possibly a cricket bat or iron pipe."
2,Bludgeon,"In the dark alley behind the warehouse, the thieves attempted to <blank> the night watchman before ransacking the premises."
2,Bludgeon,The archaeological evidence suggested that prehistoric humans would often <blank> their prey with stone clubs before using sharper tools for butchering.
2,Bludgeon,"During the violent pub brawl in Manchester, one man grabbed a bar stool and tried to <blank> his opponent before being restrained by security."
2,Bludgeon,The forensic report indicated that someone had attempted to <blank> the door lock with a hammer when they couldn't pick it open.
2,Bludgeon,"In the medieval torture chamber exhibit, the museum displayed various implements including a wooden <blank> studded with iron nails."
2,Bludgeon,"The home invasion turned violent when the burglars discovered the owner awake, and they used a torch to <blank> him unconscious."
2,Bludgeon,"According to the witness statement, the assailant didn't use a knife but rather tried to <blank> the shopkeeper with a length of lead pipe."
2,Bludgeon,The crime novel described how the murderer would <blank> his victims with a candlestick before staging the scenes to look like accidents.
2,Bludgeon,"In the disputed inheritance case, the prosecution alleged that the nephew had used a brass <blank> to kill his wealthy uncle in the study."
2,Boastful,"After winning the regional tennis championship, young Timothy became insufferably <blank>, constantly reminding everyone of his achievement."
2,Boastful,The new manager's <blank> attitude about his previous successes at rival companies quickly alienated the established team members.
2,Boastful,"Despite her genuine accomplishments as a surgeon, Dr. Patel was never <blank>, preferring to let her work speak for itself."
2,Boastful,The candidate's <blank> claims during the interview about single-handedly transforming his previous employer raised suspicions amongst the panel.
2,Boastful,"At the school reunion, George's <blank> narrative about his supposedly glamorous lifestyle in Dubai seemed wildly exaggerated to his old friends."
2,Boastful,The novelist's <blank> declaration that his latest book would revolutionise English literature was met with raised eyebrows from critics.
2,Boastful,"Rather than being <blank> about his war medals, the elderly veteran rarely spoke of his service unless directly asked by younger generations."
2,Boastful,The footballer's increasingly <blank> social media posts about his wealth and lifestyle made him deeply unpopular with supporters.
2,Boastful,"During the expedition debriefing, the team leader avoided any <blank> language, instead crediting the entire crew for their successful summit."
2,Boastful,The politician's <blank> speech about his party's achievements ignored the contributions of coalition partners and civil servants.
2,Braggart,The office <blank> spent every lunch break regaling unwilling listeners with exaggerated tales of his weekend adventures and supposed romantic conquests.
2,Braggart,"Shakespeare's Falstaff is perhaps literature's most famous <blank>, constantly inflating his courage whilst running from actual danger."
2,Braggart,"At the regimental dinner, the young lieutenant proved himself an tiresome <blank>, boasting endlessly about his family's military heritage."
2,Braggart,"The village pub had always attracted its share of <blank>s, but none quite as insufferable as the new regular who claimed friendship with celebrities."
2,Braggart,"Despite being an obvious <blank> whose fishing stories grew more elaborate with each telling, old Fred remained oddly popular at the angling club."
